[
  {
    "id": "imd-forecaster-training-course",
    "type": "course",
    "title": "Forecaster Training Course",
    "provider": "India Meteorological Department, Meteorological Training Institute",
    "provider_domain": "imdpune.gov.in",
    "domain_type": "government",
    "subject": "Weather Forecasting and Numerical Weather Prediction",
    "sub_topics": ["weather analyses", "forecasts and warnings", "dynamic meteorology", "numerical weather prediction", "synoptic meteorology", "aviation meteorology", "climate science", "hydro-meteorology"],
    "level": null,
    "language": ["English"],
    "duration": "6 months (2 Months distant learning + 4 months classroom teaching) at Pune Centre and New Delhi centres",
    "format": "online course",
    "cost": "unknown",
    "access": "open",
    "url": "https://www.imdpune.gov.in/training/academics/forecaster.html",
    "direct_file_url": null,
    "file_type": null,
    "file_size": null,
    "summary": "This IMD program prepares serving meteorological officers to support forecast analysis, warning preparation, and climate services. It combines theory, practical examinations, field attachments, and a supervised project.",
    "modules": ["Dynamic Meteorology & Numerical weather Prediction", "Physical Meteorology", "Synoptic Meteorology & Aviation Meteorology", "Climate Science & Hydro-Meteorology", "Physical Oceanography & Ocean Atmosphere interaction", "Satellite Meteorology and Radar Meteorology", "Statistics and Computer programming & application"],
    "prerequisites": "B.Sc. (with Physics or Math's as main subject) and successfully completion of BIP- MT course",
    "certificate_offered": "yes",
    "license_name": null,
    "license_url": null,
    "license_evidence": "No reuse license or redistribution terms were visible on the publicly accessible course page.",
    "redistribution_allowed": "unknown",
    "attribution_text": null,
    "embeddable": "unknown",
    "date_published_or_updated": null,
    "verified_date": "2026-09-30",
    "verified_by_opening_page": true,
    "confidence": "high",
    "notes": "The page identifies the target audience as Group-B level gazetted officers; it does not describe public registration." 
  },
  {
    "id": "imd-forecaster-course-syllabus",
    "type": "lecture_notes",
    "title": "Forecaster Training Course",
    "provider": "India Meteorological Department, Meteorological Training Institute",
    "provider_domain": "imdpune.gov.in",
    "domain_type": "government",
    "subject": "Weather Forecasting and Numerical Weather Prediction",
    "sub_topics": ["dynamic meteorology", "numerical weather prediction", "synoptic meteorology", "aviation meteorology", "hydro-meteorology", "satellite meteorology", "radar meteorology", "statistics and computing"],
    "level": null,
    "language": ["English"],
    "duration": null,
    "format": "pdf",
    "cost": "unknown",
    "access": "open",
    "url": "https://www.imdpune.gov.in/training/syllabus/syllabusftc.pdf",
    "direct_file_url": "https://www.imdpune.gov.in/training/syllabus/syllabusftc.pdf",
    "file_type": "pdf",
    "file_size": null,
    "summary": "This syllabus sets out the subjects in IMD's forecaster training program. It spans core meteorology and NWP alongside ocean-atmosphere interaction, remote sensing, radar, statistics, and computing.",
    "modules": ["Dynamic Meteorology", "Numerical weather Prediction", "Physical Meteorology", "Synoptic Meteorology and Aviation Meteorology", "Climate Science and Hydro-Meteorology", "Physical Oceanography & Ocean Atmosphere interaction", "Satellite Meteorology and Radar Meteorology", "Statistics and Computer programming & application"],
    "prerequisites": null,
    "certificate_offered": "unknown",
    "license_name": null,
    "license_url": null,
    "license_evidence": "No reuse license or redistribution terms were visible in the opened PDF.",
    "redistribution_allowed": "unknown",
    "attribution_text": null,
    "embeddable": "unknown",
    "date_published_or_updated": "2019",
    "verified_date": "2026-09-30",
    "verified_by_opening_page": true,
    "confidence": "high",
    "notes": null
  },
  {
    "id": "imd-nwp-operational-products",
    "type": "tool",
    "title": "Numerical Weather Prediction",
    "provider": "India Meteorological Department, Numerical Weather Prediction Division",
    "provider_domain": "nwp.imd.gov.in",
    "domain_type": "government",
    "subject": "Weather Forecasting and Numerical Weather Prediction",
    "sub_topics": ["operational global model charts", "MSLP", "rainfall", "marine products", "10 m wind", "geopotential height", "pressure-level winds", "forecast cycles"],
    "level": null,
    "language": ["English"],
    "duration": null,
    "format": "web portal",
    "cost": "unknown",
    "access": "open",
    "url": "https://nwp.imd.gov.in/gfsproducts_cycle00_mausam.php",
    "direct_file_url": null,
    "file_type": null,
    "file_size": null,
    "summary": "This portal displays IMD operational global-model guidance by forecast cycle and parameter. Users can inspect fields such as pressure, rainfall, marine winds, and winds at multiple pressure levels.",
    "modules": ["Cycle run selection", "Parameter selection", "Model charts"],
    "prerequisites": null,
    "certificate_offered": "unknown",
    "license_name": null,
    "license_url": null,
    "license_evidence": "No redistribution license or reuse terms were visible on the portal page.",
    "redistribution_allowed": "unknown",
    "attribution_text": null,
    "embeddable": "unknown",
    "date_published_or_updated": null,
    "verified_date": "2026-09-30",
    "verified_by_opening_page": true,
    "confidence": "high",
    "notes": "IMD labels these charts as model guidance and directs users to its official bulletin or warning for the final forecast."
  },
  {
    "id": "ecmwf-understanding-weather-forecast-uncertainty",
    "type": "course",
    "title": "Understanding Uncertainty in Weather Forecasts",
    "provider": "European Centre for Medium-Range Weather Forecasts",
    "provider_domain": "ecmwf.int",
    "domain_type": "international_body",
    "subject": "Weather Forecasting and Numerical Weather Prediction",
    "sub_topics": ["sources of forecast uncertainty", "early warning systems", "forecast communication", "forecast value chain"],
    "level": null,
    "language": ["English"],
    "duration": null,
    "format": "online course",
    "cost": "unknown",
    "access": "login_required",
    "url": "https://learning.ecmwf.int/enrol/index.php?id=92",
    "direct_file_url": null,
    "file_type": null,
    "file_size": null,
    "summary": "This short ECMWF learning module introduces sources of uncertainty in weather forecasts and considers how they can be conveyed through warning systems. The page describes a quiz-based learning check and places the module within the MedEWSa project.",
    "modules": ["Lesson 1"],
    "prerequisites": null,
    "certificate_offered": "unknown",
    "license_name": null,
    "license_url": "https://www.ecmwf.int/en/terms-use",
    "license_evidence": "ECMWF terms apply CC BY 4.0 to public website content without a separate rights notice, but the course content requires sign-in and its item-specific reuse terms were not visible.",
    "redistribution_allowed": "unknown",
    "attribution_text": null,
    "embeddable": "unknown",
    "date_published_or_updated": "2026-09-29",
    "verified_date": "2026-09-30",
    "verified_by_opening_page": true,
    "confidence": "high",
    "notes": "The public course description is visible without login; starting the course requires logging in or creating an ECMWF account."
  },
  {
    "id": "noaa-jetstream-weather-school",
    "type": "tool",
    "title": "JetStream - An Online School for Weather",
    "provider": "National Oceanic and Atmospheric Administration, National Weather Service",
    "provider_domain": "noaa.gov",
    "domain_type": "government",
    "subject": "Weather Forecasting and Numerical Weather Prediction",
    "sub_topics": ["atmosphere", "global weather", "synoptic meteorology", "upper-air charts", "satellites", "Doppler radar", "tropical weather", "weather hazards"],
    "level": null,
    "language": ["English"],
    "duration": null,
    "format": "web portal",
    "cost": "unknown",
    "access": "open",
    "url": "https://www.noaa.gov/jetstream",
    "direct_file_url": null,
    "file_type": null,
    "file_size": null,
    "summary": "NOAA's online weather school organizes illustrated learning material into topic-based lessons and activities. It is aimed at educators, emergency managers, and other people interested in weather and safety.",
    "modules": ["The Atmosphere", "The Ocean", "Global Weather", "Clouds", "The Upper Air", "Upper Air Charts", "Synoptic Meteorology", "Satellites", "Doppler Radar", "Tropical Weather", "Thunderstorms", "Lightning", "Derechos", "Tsunamis", "The National Weather Service", "Appendix"],
    "prerequisites": null,
    "certificate_offered": "unknown",
    "license_name": "NOAA JetStream reuse statement",
    "license_url": "https://www.noaa.gov/jetstream",
    "license_evidence": "The JetStream page explicitly says its materials may be used in any manner.",
    "redistribution_allowed": "yes",
    "attribution_text": null,
    "embeddable": "unknown",
    "date_published_or_updated": "2023-10-27",
    "verified_date": "2026-09-30",
    "verified_by_opening_page": true,
    "confidence": "high",
    "notes": "The page describes a collection of lessons, not a single instructor-led course."
  },
  {
    "id": "noaa-jetstream-weather-models",
    "type": "article",
    "title": "Weather Models",
    "provider": "National Oceanic and Atmospheric Administration, National Weather Service",
    "provider_domain": "noaa.gov",
    "domain_type": "government",
    "subject": "Weather Forecasting and Numerical Weather Prediction",